{
  "bug_diff": {
    "description": "The change that introduced the defect, applied to the working code.",
    "evidence_id": "BUG_DIFF",
    "files_changed": 1,
    "lines_added": 1,
    "lines_deleted": 27,
    "path": "bug_diff.diff",
    "sha256": "35a3daa3c9352bda146883279675e4ee25f93eb70fc7f1039deeca14553e7dc9"
  },
  "case_id": "SWESMITH_034",
  "code_context": [
    {
      "evidence_id": "CODE_CONTEXT_01",
      "path": "context/01_result.py",
      "repo_path": "src/result/result.py",
      "sha256": "5851c7a65fa8cef13a5e27d93ef37d7ec71cb71c77605ce38b9aecd9670393f2"
    }
  ],
  "evidence_ids": [
    "BUG_DIFF",
    "CODE_CONTEXT_01",
    "REFERENCE_REPAIR",
    "SPECIFICATION",
    "TEST_FAILURE_01",
    "TEST_FAILURE_02",
    "TEST_FAILURE_03"
  ],
  "failing_tests": {
    "evidence_id_prefix": "TEST_FAILURE",
    "failing_count": 3,
    "passing_count": 46,
    "path": "test_evidence.md",
    "sha256": "1896b3d1b359216009dfa4c753dc1813f5b2520bdd8ba53f9605b577714284a7",
    "tests": [
      {
        "evidence_id": "TEST_FAILURE_01",
        "test_file": "tests/test_result.py",
        "test_name": "tests/test_result.py::test_inspect"
      },
      {
        "evidence_id": "TEST_FAILURE_02",
        "test_file": "tests/test_result.py",
        "test_name": "tests/test_result.py::test_inspect_err"
      },
      {
        "evidence_id": "TEST_FAILURE_03",
        "test_file": "tests/test_result.py",
        "test_name": "tests/test_result.py::test_inspect_regular_fn"
      }
    ]
  },
  "packet_version": 2,
  "reference_repair": {
    "description": "The reverse of the bug diff: it restores the working code.",
    "evidence_id": "REFERENCE_REPAIR",
    "path": "reference_repair.diff",
    "sha256": "4f0e35188c51e4a66573d70833891d445f017335bdc215505de71dc3752c022c"
  },
  "repository": {
    "language": "python",
    "name": "rustedpy/result"
  },
  "reviewer_question": "Based only on the frozen evidence in this packet, what kind of technical failure does this synthetic buggy repository state represent?",
  "specification": {
    "description": "The issue text supplied with this task. A description of the defect, not independent evidence of it; it may be inaccurate.",
    "evidence_id": "SPECIFICATION",
    "path": "specification.md",
    "sha256": "443b4bdade196255b31649a5457d9360cd5506c2805e7ba2575b024f6f4c7ecc"
  }
}
