{
  "bug_diff": {
    "description": "The change that introduced the defect, applied to the working code.",
    "evidence_id": "BUG_DIFF",
    "files_changed": 1,
    "lines_added": 17,
    "lines_deleted": 12,
    "path": "bug_diff.diff",
    "sha256": "cd5729c2e702d4ce547bb0409d70ad47d5707fc39a04dffaf87788c05dd6a6e5"
  },
  "case_id": "SWESMITH_092",
  "code_context": [
    {
      "evidence_id": "CODE_CONTEXT_01",
      "path": "context/01_structure.py",
      "repo_path": "pdfplumber/structure.py",
      "sha256": "15bb05340564d8271821b6b29b9799b455829bf84a6391d6b80d8a6d219428df"
    }
  ],
  "evidence_ids": [
    "BUG_DIFF",
    "CODE_CONTEXT_01",
    "REFERENCE_REPAIR",
    "SPECIFICATION",
    "TEST_FAILURE_01",
    "TEST_FAILURE_02",
    "TEST_FAILURE_03",
    "TEST_FAILURE_04",
    "TEST_FAILURE_05",
    "TEST_FAILURE_06",
    "TEST_FAILURE_07",
    "TEST_FAILURE_08",
    "TEST_FAILURE_09",
    "TEST_FAILURE_10"
  ],
  "failing_tests": {
    "evidence_id_prefix": "TEST_FAILURE",
    "failing_count": 10,
    "passing_count": 159,
    "path": "test_evidence.md",
    "sha256": "865a9480695845f4ca39f7e3a2da667139a2824ec41c84199937434b7197a99c",
    "tests": [
      {
        "evidence_id": "TEST_FAILURE_01",
        "test_file": "tests/test_convert.py",
        "test_name": "tests/test_convert.py::Test::test_cli_structure_text"
      },
      {
        "evidence_id": "TEST_FAILURE_02",
        "test_file": "tests/test_structure.py",
        "test_name": "tests/test_structure.py::Test::test_structure_tree"
      },
      {
        "evidence_id": "TEST_FAILURE_03",
        "test_file": "tests/test_structure.py",
        "test_name": "tests/test_structure.py::TestMany::test_figure_mcids"
      },
      {
        "evidence_id": "TEST_FAILURE_04",
        "test_file": "tests/test_structure.py",
        "test_name": "tests/test_structure.py::TestMany::test_hello_structure"
      },
      {
        "evidence_id": "TEST_FAILURE_05",
        "test_file": "tests/test_structure.py",
        "test_name": "tests/test_structure.py::TestMany::test_image_structure"
      },
      {
        "evidence_id": "TEST_FAILURE_06",
        "test_file": "tests/test_structure.py",
        "test_name": "tests/test_structure.py::TestMany::test_missing_parenttree"
      },
      {
        "evidence_id": "TEST_FAILURE_07",
        "test_file": "tests/test_structure.py",
        "test_name": "tests/test_structure.py::TestMany::test_proces_verbal"
      },
      {
        "evidence_id": "TEST_FAILURE_08",
        "test_file": "tests/test_structure.py",
        "test_name": "tests/test_structure.py::TestMany::test_scotus"
      },
      {
        "evidence_id": "TEST_FAILURE_09",
        "test_file": "tests/test_structure.py",
        "test_name": "tests/test_structure.py::TestMany::test_word365"
      },
      {
        "evidence_id": "TEST_FAILURE_10",
        "test_file": "tests/test_structure.py",
        "test_name": "tests/test_structure.py::TestUnparsed::test_unparsed_pages"
      }
    ]
  },
  "packet_version": 2,
  "reference_repair": {
    "description": "The reverse of the bug diff: it restores the working code.",
    "evidence_id": "REFERENCE_REPAIR",
    "path": "reference_repair.diff",
    "sha256": "2b1a75d590c95c26c77e89c37499e4a728b6cb0b31ea174f3de023fa75af2670"
  },
  "repository": {
    "language": "python",
    "name": "jsvine/pdfplumber"
  },
  "reviewer_question": "Based only on the frozen evidence in this packet, what kind of technical failure does this synthetic buggy repository state represent?",
  "specification": {
    "description": "The issue text supplied with this task. A description of the defect, not independent evidence of it; it may be inaccurate.",
    "evidence_id": "SPECIFICATION",
    "path": "specification.md",
    "sha256": "53ab62c5eea2ba1a48d17552ea36f51e1afe8ba8e4c8a9c89752f6a7992ca153"
  }
}
