{
  "bug_diff": {
    "description": "The change that introduced the defect, applied to the working code.",
    "evidence_id": "BUG_DIFF",
    "files_changed": 1,
    "lines_added": 64,
    "lines_deleted": 25,
    "path": "bug_diff.diff",
    "sha256": "4f52083712e7cb1978cc43511c698dd489ae268b202028f41fe275f2f29dcd2b"
  },
  "case_id": "SWESMITH_044",
  "code_context": [
    {
      "evidence_id": "CODE_CONTEXT_01",
      "path": "context/01___init__.py",
      "repo_path": "usaddress/__init__.py",
      "sha256": "cb0a6186d996730544dabcadb7cc592109b3f88cdbe0cfe9b756f8aa2828a8ab"
    }
  ],
  "evidence_ids": [
    "BUG_DIFF",
    "CODE_CONTEXT_01",
    "REFERENCE_REPAIR",
    "SPECIFICATION",
    "TEST_FAILURE_01"
  ],
  "failing_tests": {
    "evidence_id_prefix": "TEST_FAILURE",
    "failing_count": 1,
    "passing_count": 8,
    "path": "test_evidence.md",
    "sha256": "07f57435b2cda53bba3fedfcac4a2d5178b882ba5bd8921455d47a33ff13aadb",
    "tests": [
      {
        "evidence_id": "TEST_FAILURE_01",
        "test_file": "tests/test_token_features.py",
        "test_name": "tests/test_token_features.py::TestTokenFeatures::test_unicode"
      }
    ]
  },
  "packet_version": 2,
  "reference_repair": {
    "description": "The reverse of the bug diff: it restores the working code.",
    "evidence_id": "REFERENCE_REPAIR",
    "path": "reference_repair.diff",
    "sha256": "9928f28c0370b16942f08746d66f584893539c9b6a94274e784b31a8b2003707"
  },
  "repository": {
    "language": "python",
    "name": "datamade/usaddress"
  },
  "reviewer_question": "Based only on the frozen evidence in this packet, what kind of technical failure does this synthetic buggy repository state represent?",
  "specification": {
    "description": "The issue text supplied with this task. A description of the defect, not independent evidence of it; it may be inaccurate.",
    "evidence_id": "SPECIFICATION",
    "path": "specification.md",
    "sha256": "c494a64f1206d13f4e2e159764ade030dac5b4c20d7e1c91eec2b5959f812b57"
  }
}
