{
  "bug_diff": {
    "description": "The change that introduced the defect, applied to the working code.",
    "evidence_id": "BUG_DIFF",
    "files_changed": 1,
    "lines_added": 1,
    "lines_deleted": 2,
    "path": "bug_diff.diff",
    "sha256": "63b5d5bd8124b252aca92377110ee19677a70268b426243363bc26c29dacec29"
  },
  "case_id": "SWESMITH_064",
  "code_context": [
    {
      "evidence_id": "CODE_CONTEXT_01",
      "path": "context/01_shared.py",
      "repo_path": "src/pptx/oxml/shapes/shared.py",
      "sha256": "744ee1eb77d92c4c48a8782d446acbeab6ff756878065a71a5ce70ec86c4e31b"
    }
  ],
  "evidence_ids": [
    "BUG_DIFF",
    "CODE_CONTEXT_01",
    "REFERENCE_REPAIR",
    "SPECIFICATION",
    "TEST_FAILURE_01",
    "TEST_FAILURE_02",
    "TEST_FAILURE_03",
    "TEST_FAILURE_04",
    "TEST_FAILURE_05",
    "TEST_FAILURE_06",
    "TEST_FAILURE_07",
    "TEST_FAILURE_08",
    "TEST_FAILURE_09",
    "TEST_FAILURE_10",
    "TEST_FAILURE_11",
    "TEST_FAILURE_12",
    "TEST_FAILURE_13",
    "TEST_FAILURE_14",
    "TEST_FAILURE_15",
    "TEST_FAILURE_16",
    "TEST_FAILURE_17",
    "TEST_FAILURE_18",
    "TEST_FAILURE_19",
    "TEST_FAILURE_20"
  ],
  "failing_tests": {
    "evidence_id_prefix": "TEST_FAILURE",
    "failing_count": 39,
    "passing_count": 2618,
    "path": "test_evidence.md",
    "sha256": "6ba2f8170d9dd69dfcdf76cfb2b53186602122a1c25e4e824eabfde982309098",
    "tests": [
      {
        "evidence_id": "TEST_FAILURE_01",
        "test_file": "tests/oxml/shapes/test_groupshape.py",
        "test_name": "tests/oxml/shapes/test_groupshape.py::DescribeCT_GroupShape::it_calculates_its_child_extents_to_help[child_exts_fixture1]"
      },
      {
        "evidence_id": "TEST_FAILURE_02",
        "test_file": "tests/oxml/shapes/test_groupshape.py",
        "test_name": "tests/oxml/shapes/test_groupshape.py::DescribeCT_GroupShape::it_calculates_its_child_extents_to_help[child_exts_fixture2]"
      },
      {
        "evidence_id": "TEST_FAILURE_03",
        "test_file": "tests/oxml/shapes/test_groupshape.py",
        "test_name": "tests/oxml/shapes/test_groupshape.py::DescribeCT_GroupShape::it_calculates_its_child_extents_to_help[child_exts_fixture3]"
      },
      {
        "evidence_id": "TEST_FAILURE_04",
        "test_file": "tests/shapes/test_base.py",
        "test_name": "tests/shapes/test_base.py::DescribeBaseShape::it_has_a_position[p:cxnSp/p:spPr/a:xfrm-None-None]"
      },
      {
        "evidence_id": "TEST_FAILURE_05",
        "test_file": "tests/shapes/test_base.py",
        "test_name": "tests/shapes/test_base.py::DescribeBaseShape::it_has_a_position[p:cxnSp/p:spPr/a:xfrm/a:off{x=123,y=456}-123-456]"
      },
      {
        "evidence_id": "TEST_FAILURE_06",
        "test_file": "tests/shapes/test_base.py",
        "test_name": "tests/shapes/test_base.py::DescribeBaseShape::it_has_a_position[p:graphicFrame/p:xfrm-None-None]"
      },
      {
        "evidence_id": "TEST_FAILURE_07",
        "test_file": "tests/shapes/test_base.py",
        "test_name": "tests/shapes/test_base.py::DescribeBaseShape::it_has_a_position[p:graphicFrame/p:xfrm/a:off{x=123,y=456}-123-456]"
      },
      {
        "evidence_id": "TEST_FAILURE_08",
        "test_file": "tests/shapes/test_base.py",
        "test_name": "tests/shapes/test_base.py::DescribeBaseShape::it_has_a_position[p:grpSp/p:grpSpPr/a:xfrm/a:off{x=123,y=456}-123-456]"
      },
      {
        "evidence_id": "TEST_FAILURE_09",
        "test_file": "tests/shapes/test_base.py",
        "test_name": "tests/shapes/test_base.py::DescribeBaseShape::it_has_a_position[p:pic/p:spPr/a:xfrm-None-None]"
      },
      {
        "evidence_id": "TEST_FAILURE_10",
        "test_file": "tests/shapes/test_base.py",
        "test_name": "tests/shapes/test_base.py::DescribeBaseShape::it_has_a_position[p:pic/p:spPr/a:xfrm/a:off{x=123,y=456}-123-456]"
      },
      {
        "evidence_id": "TEST_FAILURE_11",
        "test_file": "tests/shapes/test_base.py",
        "test_name": "tests/shapes/test_base.py::DescribeBaseShape::it_has_a_position[p:sp/p:spPr/a:xfrm-None-None]"
      },
      {
        "evidence_id": "TEST_FAILURE_12",
        "test_file": "tests/shapes/test_base.py",
        "test_name": "tests/shapes/test_base.py::DescribeBaseShape::it_has_a_position[p:sp/p:spPr/a:xfrm/a:off{x=123,y=456}-123-456]"
      },
      {
        "evidence_id": "TEST_FAILURE_13",
        "test_file": "tests/shapes/test_connector.py",
        "test_name": "tests/shapes/test_connector.py::DescribeConnector::it_can_change_its_begin_point_y_location[begin_y_set_fixture0]"
      },
      {
        "evidence_id": "TEST_FAILURE_14",
        "test_file": "tests/shapes/test_connector.py",
        "test_name": "tests/shapes/test_connector.py::DescribeConnector::it_can_change_its_begin_point_y_location[begin_y_set_fixture1]"
      },
      {
        "evidence_id": "TEST_FAILURE_15",
        "test_file": "tests/shapes/test_connector.py",
        "test_name": "tests/shapes/test_connector.py::DescribeConnector::it_can_change_its_begin_point_y_location[begin_y_set_fixture2]"
      },
      {
        "evidence_id": "TEST_FAILURE_16",
        "test_file": "tests/shapes/test_connector.py",
        "test_name": "tests/shapes/test_connector.py::DescribeConnector::it_can_change_its_begin_point_y_location[begin_y_set_fixture3]"
      },
      {
        "evidence_id": "TEST_FAILURE_17",
        "test_file": "tests/shapes/test_connector.py",
        "test_name": "tests/shapes/test_connector.py::DescribeConnector::it_can_change_its_begin_point_y_location[begin_y_set_fixture4]"
      },
      {
        "evidence_id": "TEST_FAILURE_18",
        "test_file": "tests/shapes/test_connector.py",
        "test_name": "tests/shapes/test_connector.py::DescribeConnector::it_can_change_its_begin_point_y_location[begin_y_set_fixture5]"
      },
      {
        "evidence_id": "TEST_FAILURE_19",
        "test_file": "tests/shapes/test_connector.py",
        "test_name": "tests/shapes/test_connector.py::DescribeConnector::it_can_change_its_end_point_y_location[end_y_set_fixture0]"
      },
      {
        "evidence_id": "TEST_FAILURE_20",
        "test_file": "tests/shapes/test_connector.py",
        "test_name": "tests/shapes/test_connector.py::DescribeConnector::it_can_change_its_end_point_y_location[end_y_set_fixture1]"
      }
    ]
  },
  "packet_version": 2,
  "reference_repair": {
    "description": "The reverse of the bug diff: it restores the working code.",
    "evidence_id": "REFERENCE_REPAIR",
    "path": "reference_repair.diff",
    "sha256": "ffe6d9beb2ba981bdcab0c858a12cd7e6375d964a07e81ad536e00b5e262c0da"
  },
  "repository": {
    "language": "python",
    "name": "scanny/python-pptx"
  },
  "reviewer_question": "Based only on the frozen evidence in this packet, what kind of technical failure does this synthetic buggy repository state represent?",
  "specification": {
    "description": "The issue text supplied with this task. A description of the defect, not independent evidence of it; it may be inaccurate.",
    "evidence_id": "SPECIFICATION",
    "path": "specification.md",
    "sha256": "2a4e9ea8c3d7050013a21bc410f2fa15aff03212db5b92889908bf8fbfa80b54"
  }
}
